{
  "corpus_id": "voisu-developer-prompt-rendering-intent-routing-2026-08-11",
  "version": "1.0.2",
  "issue": {
    "github_number": 141,
    "title": "Prototype weighted intent routing and local fast paths",
    "parent_map": 133,
    "blocks": [
      144
    ],
    "url": "https://github.com/Anuraj-dev/voisu/issues/141"
  },
  "language": "en",
  "governing": {
    "contract_issue": 137,
    "map_issue": 133,
    "behavior_corpus_issue": 138,
    "delivery_deadline_ms": 1500,
    "network_on_decision_path": false,
    "out_of_scope": [
      "grammar correction",
      "prompt enrichment inventing requirements",
      "cloud client or network I/O on the decision path",
      "Structured label invention inside the router",
      "auto-send",
      "live typing",
      "clipboard page or screenshot context",
      "wall-clock sleeps in tests"
    ]
  },
  "routes": [
    "literal_identity",
    "deterministic_local",
    "local_with_optional_cloud"
  ],
  "cloud_request_states": [
    "not_allowed",
    "allowed",
    "required"
  ],
  "policies": [
    "natural",
    "adaptive",
    "structured"
  ],
  "provider_states": [
    "exact_agreement",
    "punctuation_only_agreement",
    "safe_complementary",
    "protected_token_disagreement",
    "semantic_disagreement",
    "single_provider"
  ],
  "surface_hints": [
    "shell",
    "terminal",
    "coding_agent",
    "gui_agent",
    "messaging",
    "browser",
    "unknown",
    null
  ],
  "process_classes": [
    "shell",
    "terminal",
    "coding_agent",
    "gui_agent",
    "messaging",
    "browser",
    "unknown"
  ],
  "rule_ids": [
    "R_DISPUTE_CLOUD",
    "R_DISPUTE_POLICY_FORBID",
    "R_LITERAL_PREFORMATTED",
    "R_LITERAL_COMMAND",
    "R_NATURAL_LOCAL",
    "R_COMPLEX_CLOUD",
    "R_DEFAULT_LOCAL"
  ],
  "weights": {
    "section_goal": 12,
    "section_context": 12,
    "section_requirements": 12,
    "section_constraints": 12,
    "section_steps": 12,
    "section_acceptance_criteria": 14,
    "section_files": 10,
    "section_notes": 10,
    "words_ge_40": 4,
    "words_ge_80": 6,
    "surface_coding_agent_sections": 4,
    "surface_gui_agent_sections": 3,
    "surface_messaging_short": -6,
    "surface_browser_short": -4,
    "process_coding_boost": 2,
    "timing_clear_pause": 0,
    "timing_uncertain_pause": 0
  },
  "thresholds": {
    "complexity_cloud": 24,
    "messaging_short_words": 30,
    "browser_short_words": 25,
    "section_cues_for_length_assist": 2,
    "delivery_deadline_ms": 1500
  },
  "closed_tags": [
    "policy-natural",
    "policy-adaptive",
    "policy-structured",
    "route-literal",
    "route-local",
    "route-cloud-optional",
    "cloud-not-allowed",
    "cloud-allowed",
    "cloud-required",
    "surface-shell",
    "surface-terminal",
    "surface-coding-agent",
    "surface-gui-agent",
    "surface-messaging",
    "surface-browser",
    "surface-unknown",
    "surface-null",
    "process-hint",
    "speech-only",
    "stt-exact",
    "stt-punct",
    "stt-complementary",
    "stt-protected-disagreement",
    "stt-semantic-disagreement",
    "stt-single",
    "complex-multi-section",
    "simple-section",
    "simple-everyday",
    "preformatted",
    "command-shaped",
    "timing-clear",
    "timing-uncertain",
    "negative-n1",
    "negative-n2",
    "negative-n3",
    "negative-n4",
    "negative-n5",
    "negative-n6",
    "long-everyday-no-sections"
  ],
  "coverage_requirements": [
    "policy-natural",
    "policy-adaptive",
    "policy-structured",
    "route-literal",
    "route-local",
    "route-cloud-optional",
    "cloud-not-allowed",
    "cloud-allowed",
    "cloud-required",
    "surface-shell",
    "surface-terminal",
    "surface-coding-agent",
    "surface-gui-agent",
    "surface-messaging",
    "surface-browser",
    "surface-unknown",
    "surface-null",
    "process-hint",
    "speech-only",
    "stt-exact",
    "stt-punct",
    "stt-complementary",
    "stt-protected-disagreement",
    "stt-semantic-disagreement",
    "stt-single",
    "complex-multi-section",
    "simple-section",
    "simple-everyday",
    "preformatted",
    "command-shaped",
    "timing-clear",
    "timing-uncertain",
    "negative-n1",
    "negative-n2",
    "negative-n3",
    "negative-n4",
    "negative-n5",
    "negative-n6",
    "long-everyday-no-sections"
  ],
  "coverage_matrix": {
    "policy-natural": [
      "IRI-02",
      "IRI-12",
      "IRI-15",
      "IRI-37"
    ],
    "policy-adaptive": [
      "IRI-01",
      "IRI-03",
      "IRI-04",
      "IRI-05",
      "IRI-06",
      "IRI-07",
      "IRI-08",
      "IRI-09",
      "IRI-10",
      "IRI-11",
      "IRI-13",
      "IRI-16",
      "IRI-18",
      "IRI-19",
      "IRI-20",
      "IRI-21",
      "IRI-22",
      "IRI-23",
      "IRI-24",
      "IRI-25",
      "IRI-26",
      "IRI-27",
      "IRI-29",
      "IRI-30",
      "IRI-31",
      "IRI-32",
      "IRI-33",
      "IRI-34",
      "IRI-35",
      "IRI-36",
      "IRI-38",
      "IRI-39",
      "IRI-40"
    ],
    "policy-structured": [
      "IRI-14",
      "IRI-17",
      "IRI-28"
    ],
    "route-literal": [
      "IRI-03",
      "IRI-04",
      "IRI-05",
      "IRI-27",
      "IRI-30",
      "IRI-34"
    ],
    "route-local": [
      "IRI-01",
      "IRI-02",
      "IRI-06",
      "IRI-07",
      "IRI-08",
      "IRI-09",
      "IRI-12",
      "IRI-15",
      "IRI-16",
      "IRI-17",
      "IRI-18",
      "IRI-19",
      "IRI-20",
      "IRI-21",
      "IRI-23",
      "IRI-25",
      "IRI-26",
      "IRI-29",
      "IRI-31",
      "IRI-32",
      "IRI-33",
      "IRI-37",
      "IRI-38",
      "IRI-39",
      "IRI-40"
    ],
    "route-cloud-optional": [
      "IRI-10",
      "IRI-11",
      "IRI-13",
      "IRI-14",
      "IRI-22",
      "IRI-24",
      "IRI-28",
      "IRI-35",
      "IRI-36"
    ],
    "cloud-not-allowed": [
      "IRI-01",
      "IRI-02",
      "IRI-03",
      "IRI-04",
      "IRI-05",
      "IRI-06",
      "IRI-07",
      "IRI-08",
      "IRI-09",
      "IRI-12",
      "IRI-15",
      "IRI-16",
      "IRI-17",
      "IRI-18",
      "IRI-19",
      "IRI-20",
      "IRI-21",
      "IRI-23",
      "IRI-25",
      "IRI-26",
      "IRI-27",
      "IRI-29",
      "IRI-30",
      "IRI-31",
      "IRI-32",
      "IRI-33",
      "IRI-34",
      "IRI-37",
      "IRI-38",
      "IRI-39",
      "IRI-40"
    ],
    "cloud-allowed": [
      "IRI-10",
      "IRI-11",
      "IRI-13",
      "IRI-22",
      "IRI-24",
      "IRI-35",
      "IRI-36"
    ],
    "cloud-required": [
      "IRI-14",
      "IRI-28"
    ],
    "surface-shell": [
      "IRI-04",
      "IRI-26",
      "IRI-31",
      "IRI-32",
      "IRI-33",
      "IRI-34",
      "IRI-36",
      "IRI-38",
      "IRI-39"
    ],
    "surface-terminal": [
      "IRI-05"
    ],
    "surface-coding-agent": [
      "IRI-13",
      "IRI-14",
      "IRI-15",
      "IRI-16",
      "IRI-17",
      "IRI-25",
      "IRI-28"
    ],
    "surface-gui-agent": [
      "IRI-22"
    ],
    "surface-messaging": [
      "IRI-01",
      "IRI-02",
      "IRI-20"
    ],
    "surface-browser": [
      "IRI-21"
    ],
    "surface-unknown": [
      "IRI-23"
    ],
    "surface-null": [
      "IRI-03",
      "IRI-06",
      "IRI-07",
      "IRI-08",
      "IRI-09",
      "IRI-10",
      "IRI-11",
      "IRI-12",
      "IRI-18",
      "IRI-19",
      "IRI-24",
      "IRI-27",
      "IRI-29",
      "IRI-35",
      "IRI-37",
      "IRI-40"
    ],
    "process-hint": [
      "IRI-30"
    ],
    "speech-only": [
      "IRI-03",
      "IRI-06",
      "IRI-24",
      "IRI-29",
      "IRI-40"
    ],
    "stt-exact": [
      "IRI-06"
    ],
    "stt-punct": [
      "IRI-07"
    ],
    "stt-complementary": [
      "IRI-08"
    ],
    "stt-protected-disagreement": [
      "IRI-10",
      "IRI-12",
      "IRI-35",
      "IRI-36",
      "IRI-37"
    ],
    "stt-semantic-disagreement": [
      "IRI-11"
    ],
    "stt-single": [
      "IRI-01",
      "IRI-09",
      "IRI-13"
    ],
    "complex-multi-section": [
      "IRI-13",
      "IRI-14",
      "IRI-15",
      "IRI-22",
      "IRI-24",
      "IRI-28"
    ],
    "simple-section": [
      "IRI-16",
      "IRI-17",
      "IRI-25"
    ],
    "simple-everyday": [
      "IRI-01",
      "IRI-02",
      "IRI-06",
      "IRI-09",
      "IRI-20",
      "IRI-21",
      "IRI-23",
      "IRI-31",
      "IRI-32",
      "IRI-33",
      "IRI-38",
      "IRI-39",
      "IRI-40"
    ],
    "preformatted": [
      "IRI-03",
      "IRI-35",
      "IRI-37"
    ],
    "command-shaped": [
      "IRI-04",
      "IRI-05",
      "IRI-27",
      "IRI-30",
      "IRI-34",
      "IRI-36"
    ],
    "timing-clear": [
      "IRI-18"
    ],
    "timing-uncertain": [
      "IRI-19"
    ],
    "negative-n1": [
      "IRI-01",
      "IRI-20",
      "IRI-40"
    ],
    "negative-n2": [
      "IRI-06",
      "IRI-09"
    ],
    "negative-n3": [
      "IRI-10",
      "IRI-12",
      "IRI-35",
      "IRI-36",
      "IRI-37"
    ],
    "negative-n4": [
      "IRI-15"
    ],
    "negative-n5": [
      "IRI-18",
      "IRI-19"
    ],
    "negative-n6": [
      "IRI-24"
    ],
    "long-everyday-no-sections": [
      "IRI-29"
    ]
  },
  "fixtures": [
    {
      "id": "IRI-01",
      "title": "Simple Adaptive messaging everyday stays local",
      "tags": [
        "policy-adaptive",
        "route-local",
        "cloud-not-allowed",
        "surface-messaging",
        "simple-everyday",
        "stt-single",
        "negative-n1"
      ],
      "policy": "adaptive",
      "primary_text": "hey can you send the notes when you get a chance",
      "provider_state": "single_provider",
      "surface_hint": "messaging",
      "process_hint": null,
      "timing": null,
      "kind_hint": "everyday_message",
      "expected": {
        "route": "deterministic_local",
        "cloud_request": "not_allowed",
        "rule_id": "R_DEFAULT_LOCAL",
        "min_complexity_score": 0,
        "max_complexity_score": 0
      },